Section,Title,Price,Description,Image
Instrumental — Clínico,AEROPULIDOR,693,Equipo para limpieza y pulido dental con aire a presión.,https://drive.google.com/uc?export=view&id=11Zc01_9lKWE3yRVzLRF8vOwn_q4EQ16h
Instrumental — Clínico,ESCARIADOR NEUMATICO,685,Instrumento neumático para limpieza y preparación dental.,https://drive.google.com/uc?export=view&id=1hqso9K3T9WcTbBeIKD2FL7D_jEZVmeC6
Instrumental — Clínico,ESPEJOS INTRAORALES KIT CON 12,175,"Espejos intraorales para exploración dental, kit con 12.",https://drive.google.com/uc?export=view&id=13vqW7JvWpW_m1naR5dqZU-rpE-PsB1__
Instrumental — Clínico,ESPEJOS PARA FOTOGRAFÍA KIT CON 5,393,"Espejos para fotografía dental, kit de 5 unidades.",https://drive.google.com/uc?export=view&id=1IHKSwGE6J71CmWhECbcdEKXI0UOWXEvD
Instrumental — Clínico,PIEDRA DE ARKANZAS KIT CON 12,263,Kit de 12 piedras de Arkansas para afilado dental.,https://drive.google.com/uc?export=view&id=1s7Uacpe4cKvBQrw4xmBo3CA4-VtHzo35
Instrumental — Clínico,RETRACTORES NEGROS  KIT CON 4,168,Kit de 4 retractores negros para procedimientos dentales.,https://drive.google.com/uc?export=view&id=1nwH7kIHcWm-1HDhp0oOgfEiXKqB8k68-
Instrumental — Clínico,SOPLETE TIPO PLUMA,280,Soplete tipo pluma para trabajos de laboratorio dental.,https://drive.google.com/uc?export=view&id=1sItIklHMbCRbXEl3GzVRFKvu1tNIx5VK
