Section,Title,Price,Description,Image
Ortodoncia — Arcos y Resortes,ARCO NITI RECTANGULAR PAQUETE CON 10,99,"Arco de níquel-titanio rectangular, paquete con 10 unidades para ortodoncia.",https://drive.google.com/uc?export=view&id=1xIYmS2zLwp2R15sUMcgRFx02SFttC7b2
Ortodoncia — Arcos y Resortes,"ARCO NITI REDONDO 12, 14, 16, 18 PAQUETE CON 10",39,"Arco redondo de níquel-titanio en diferentes calibres, paquete con 10.",https://drive.google.com/uc?export=view&id=1N6JiuFXMS9l8intEmU3UbbqSNXfgiGEf
Ortodoncia — Arcos y Resortes,CADENA CERRADA 4.5 METROS,120,Cadena ortodóntica cerrada de 4.5 metros para tracción dental.,https://drive.google.com/uc?export=view&id=1bKnTkWnc6gVnPqsiCmZUhnJ7VH5luC2r
Ortodoncia — Arcos y Resortes,"OPEN COIL EN ROLLO .010X.030""",600,"Rollo de resorte abierto para ortodoncia, medidas .010 x .030"".",https://drive.google.com/uc?export=view&id=128Wt6j5xiLUVtGT3ixmh5TUOBeZ-iloM
Ortodoncia — Arcos y Resortes,STOPS CRIMPABLE KIT CON 10,82,Kit de 10 stops crimpables para alambres ortodónticos.,https://drive.google.com/uc?export=view&id=1ZBaAlEolFXq-Vplk66sWbIP_udym9OUT
