Section,Title,Price,Description,Image
Instrumental — Ortodoncia,GANCHO QUIRÚRGICO KIT CON 10,72,"Gancho quirúrgico para procedimientos dentales, kit con 10.",https://drive.google.com/uc?export=view&id=1jWHlG-2veO2_xkbQ85M0Xy7IJxL7KeZX
Instrumental — Ortodoncia,GANCHO QUIRÚRGICO KIT CON 50,533,"Gancho quirúrgico, kit de 50 unidades.",https://drive.google.com/uc?export=view&id=1jWHlG-2veO2_xkbQ85M0Xy7IJxL7KeZX
Instrumental — Ortodoncia,GURIN CON LLAVE CON Y 10 PZAS,243,"Llave Gurin con 10 piezas incluidas, para ortodoncia.",https://drive.google.com/uc?export=view&id=1kfLi9YnSasXsAFwix2pka4C_K-SGNu5T
Instrumental — Ortodoncia,MODULO DE LLAVE,9,Módulo de llave para ajuste y colocación de brackets.,https://drive.google.com/uc?export=view&id=1cmZlsb1CQw7Ll9iBK9jLMu0A4CGVYE-l
Instrumental — Ortodoncia,PINZA CORTE DISTAL CABEZA MINI AZDENT,837,Pinza mini para corte distal AZDENT.,https://drive.google.com/uc?export=view&id=1MeIqeCu7sN2kzDZDGbMyFy118ak_c6sv
Instrumental — Ortodoncia,PINZA GANCHO QUIRÚRGICO AZDENT,358,Pinza AZDENT para manipulación de ganchos quirúrgicos.,https://drive.google.com/uc?export=view&id=1x4X5XHCYTE8A5Cwik0TsHzjIZ1wuvyD5
Instrumental — Ortodoncia,PINZA MATHEW AZDENT,275,Pinza Mathew AZDENT para ortodoncia.,https://drive.google.com/uc?export=view&id=18KvpzJ59Iu8fEMS1whJpOKFl2SnHtCtd
